name,description,framework_id
"Objetivo 16: Promover sociedades justas, pacíficas e inclusivas","El Objetivo 16 pretende promover sociedades pacíficas e inclusivas, facilitar el acceso a la justicia para toda la población y crear instituciones eficaces, responsables e inclusivas a todos los niveles. Las personas de todo el mundo deben vivir libres del miedo a cualquier forma de violencia y sentirse seguras en su día a día, sea cual sea su origen étnico, religión u orientación sexual.
Sin embargo, los conflictos violentos, actuales y nuevos, en todo el mundo, están haciendo descarrilar el camino global hacia la paz y hacia la consecución del Objetivo 16.
Resulta alarmante que en el año 2022 se produjera un aumento en más del 50 % en el número de muertes de civiles relacionadas con los conflictos, el primero desde la adopción de la Agenda 2030, debido en gran parte a la guerra de Ucrania.
Los altos niveles de violencia armada e inseguridad tienen consecuencias destructivas para el desarrollo de un país, mientras que la violencia sexual, los delitos, la explotación y la tortura son fenómenos generalizados donde existen conflictos o no hay Estado de derecho, por lo que los países deben tomar medidas para proteger a los sectores que corren más riesgos.
Los gobiernos, la sociedad civil y las comunidades deben colaborar para encontrar soluciones duraderas a los conflictos y al clima de inseguridad. El fortalecimiento del Estado de derecho y la promoción de los derechos humanos es fundamental en este proceso, así como la reducción del tráfico de armas ilícitas, la lucha contra la corrupción y el fomento de una participación inclusiva.",1
Objetivo 17: Revitalizar la Alianza Mundial para el Desarrollo Sostenible,"El Objetivo 17 pretende revitalizar la alianza mundial para el desarrollo sostenible. La Agenda 2030 es universal y exige la implicación de todos los países, tanto desarrollados como en desarrollo, para garantizar que nadie se quede atrás. También requiere la colaboración entre los gobiernos, el sector privado y la sociedad civil.
Los Objetivos de Desarrollo Sostenible solo se pueden conseguir con asociaciones mundiales sólidas y cooperación para garantizar que nadie se quede atrás en nuestro camino hacia el desarrollo.
Sin embargo, no todos los países se encuentran en la misma situación de partida, y los países de ingresos bajos y medios afrontan enormes deudas que les impiden hacer avances en esta materia.
Después de la pandemia de la COVID-19, los países en desarrollo se enfrentan a un aumento sin precedentes de los niveles de deuda externa, agravado por retos como una inflación extrema, la escalada de las tasas de interés, prioridades contrapuestas y una capacidad fiscal limitada, lo que subraya la urgente necesidad de alivio de la deuda y asistencia financiera.
Aunque las corrientes de asistencia oficial para el desarrollo (AOD) siguen alcanzando máximos históricos, el aumento en 2022 se atribuye principalmente al gasto en refugiados en los países donantes y a la ayuda a Ucrania.
Para tener éxito, es necesario movilizar tanto los recursos existentes como los adicionales, y los países desarrollados deberán cumplir sus compromisos de aumentar la asistencia oficial para el desarrollo.",1
"1. Ordenamiento del Territorio Alrededor del Agua y Justicia
Ambiental","Esta transformación busca reorganizar el uso del territorio colombiano poniendo el agua y la biodiversidad en el centro de las decisiones, garantizando la protección de ecosistemas estratégicos como páramos, humedales y cuencas hidrográficas. Propone una gobernanza ambiental inclusiva, con participación comunitaria y la implementación de instrumentos como el catastro multipropósito y el Sistema de Administración del Territorio (SAT) para reducir conflictos socioambientales, formalizar la tenencia de tierras y promover un desarrollo urbano y rural sostenible. Además, busca modernizar la gestión del riesgo de desastres y adaptarse al cambio climático, priorizando la conservación y el acceso equitativo al agua.",2
2. Seguridad Humana y Justicia Social,"Esta línea busca garantizar el bienestar integral de la población mediante un sistema de protección social universal que incluya transferencias monetarias (como la Renta Ciudadana), acceso a salud preventiva, educación de calidad y trabajo digno. Promueve la justicia centrada en las personas, con enfoques diferenciales para víctimas del conflicto, adultos mayores y poblaciones vulnerables. También impulsa la transformación digital, la movilidad sostenible y la seguridad ciudadana desde una perspectiva de derechos humanos, buscando reducir la violencia, la pobreza y las desigualdades históricas.",2
3. Derecho Humano a la Alimentación,"Esta transformación tiene como objetivo garantizar que todos los colombianos accedan a alimentos suficientes, nutritivos y culturalmente adecuados, promoviendo sistemas agroalimentarios sostenibles. Incluye medidas para modernizar la producción rural, reducir pérdidas en las cadenas de suministro, fomentar prácticas agrícolas respetuosas con el medio ambiente y fortalecer la soberanía alimentaria. Además, busca combatir la malnutrición mediante políticas públicas que integren saberes tradicionales y enfoques territoriales, asegurando que el derecho a la alimentación sea una realidad en todos los rincones del país.",2
"4. Transformación Productiva, Internacionalización y
Acción Climática","Esta línea impulsa un cambio en el modelo económico hacia uno bajo en carbono y basado en la biodiversidad, promoviendo energías renovables, bioeconomía y reindustrialización sostenible. Incluye la protección de ecosistemas clave, la descarbonización del transporte y la adopción de prácticas circulares en ciudades y sectores productivos. También fomenta la innovación tecnológica, el turismo responsable y la integración de Colombia en cadenas globales de valor con criterios ambientales, buscando posicionar al país como líder en acción climática y desarrollo verde.",2
5. Convergencia Regional,"Esta transformación busca reducir las brechas entre regiones mediante estrategias de desarrollo territorial equilibrado, con inversión en infraestructura vial, conectividad digital y servicios básicos para zonas rurales y marginadas. Promueve la articulación entre municipios, la participación comunitaria en la planeación y la implementación de proyectos con impacto regional, especialmente en territorios afectados por el conflicto (como los PDET). Además, fortalece la gobernanza local y la cooperación fronteriza, asegurando que las políticas públicas respondan a las necesidades específicas de cada territorio.",2
Seguridad Multidimensional,"Busca reducir la pobreza multidimensional y mejorar la seguridad desde un enfoque integral que abarca no solo lo militar o policial, sino también lo social y ambiental. Este eje articula capacidades institucionales en todos los niveles (local, regional y nacional) para garantizar presencia estatal efectiva y derechos ciudadanos.",3
Prosperidad,"Enfocado en crear condiciones para el crecimiento económico, impulsando sectores estratégicos como el turismo, la educación, la infraestructura vial, el bilingüismo, el acceso al agua potable, y el empoderamiento del sector agrario. Pretende aumentar la riqueza colectiva y mejorar la calidad de vida mediante inversión social y productividad.",3
Sostenibilidad,"Este eje promueve el desarrollo económico sin comprometer los recursos naturales del departamento. Se enfoca en proteger el agua, el páramo, la biodiversidad y en fomentar proyectos de energías renovables, economía circular y responsabilidad ambiental para asegurar un entorno habitable para las futuras generaciones.",3
Educación. Línea Estratégica 1: Territorio que Integra,"Busca garantizar una educación inclusiva y de calidad, reduciendo brechas entre instituciones públicas y privadas. Incluye acciones como fortalecer la jornada única, promover el bilingüismo (meta del 40% de jóvenes bilingües para 2034), modernizar infraestructura escolar y reducir la deserción, especialmente en poblaciones vulnerables. También impulsa alianzas con universidades y programas técnicos para mejorar oportunidades laborales.",4
Salud y Protección Social. Línea Estratégica 1: Territorio que Integra,"Tiene como objetivo mejorar el acceso a servicios de salud preventiva y predictiva, con énfasis en poblaciones rurales y grupos vulnerables. Aborda problemas como enfermedades crónicas, salud mental (depresión, consumo de sustancias) y falta de articulación entre servicios sociales. Incluye ampliación de centros de salud, campañas de prevención y programas intersectoriales para atención integral.",4
Deporte y Recreación. Línea Estratégica 1: Territorio que Integra,"Promueve actividades deportivas y recreativas como herramientas de integración social y bienestar físico-mental. Focaliza esfuerzos en comunidades marginadas, con infraestructura accesible (parques, canchas) y programas para niños, jóvenes y adultos mayores. Busca reducir sedentarismo y violencia mediante el deporte, además de fomentar talentos locales.",4
Cultura. Línea Estratégica 1: Territorio que Integra,"Trabaja en la preservación y promoción de la diversidad cultural de Bucaramanga, apoyando artistas locales, patrimonios tangibles e intangibles, y espacios comunitarios. Incluye talleres artísticos, recuperación de tradiciones y eventos que fortalezcan la identidad bumanguesa, con enfoque en poblaciones históricamente excluidas (étnicas, rurales).",4
Inclusión Social y Reconciliación. Línea Estratégica 1: Territorio que Integra,"Atiende necesidades específicas de grupos vulnerables (mujeres, adultos mayores, LGBTIQ+, migrantes, víctimas del conflicto, personas con discapacidad). Implementa políticas de equidad, acceso a derechos básicos (vivienda, empleo) y procesos de reconciliación comunitaria. Ejemplos: programas contra violencia de género, inclusión laboral para discapacitados y apoyo psicosocial a víctimas.",4
Trabajo. Línea Estratégica 2: Territorio que Progresa,"Busca generar empleo formal y reducir la informalidad laboral (meta: 40% para 2027) mediante alianzas con el sector privado, capacitación técnica y apoyo a emprendimientos. Incluye programas de primer empleo para jóvenes, incentivos a empresas que contraten poblaciones vulnerables y fortalecimiento de la economía popular.",4
"Comercio, Industria y Turismo. Línea Estratégica 2: Territorio que Progresa","Impulsa la competitividad empresarial y el turismo sostenible mediante modernización de mercados, certificaciones de calidad y promoción de Bucaramanga como destino de negocios y cultura. Apoya PYMES, negocios verdes y circuitos turísticos que integren la riqueza natural y patrimonial del área metropolitana.",4
"Ciencia, Tecnología e Innovación. Línea Estratégica 2: Territorio que Progresa","Desarrolla un ecosistema de innovación con proyectos como el Parque Tecnológico, vinculación universidad-empresa y financiamiento a startups. Prioriza sectores estratégicos (salud, energía limpia, TIC) y formación en habilidades digitales para la Cuarta Revolución Industrial.",4
Tecnologías de la Información y Comunicación. Línea Estratégica 2: Territorio que Progresa,"Garantiza conectividad digital en zonas urbanas y rurales, con infraestructura de internet accesible y programas de alfabetización digital. Promueve gobierno electrónico, telemedicina y teletrabajo para reducir brechas tecnológicas.",4
Agricultura y Desarrollo Rural. Línea Estratégica 2: Territorio que Progresa,"Fortalece la agricultura campesina con asistencia técnica, comercialización de productos locales y tecnologías sostenibles. Incluye proyectos de seguridad alimentaria, riego eficiente y turismo rural para dinamizar la economía campesina.",4
Transporte. Línea Estratégica 2: Territorio que Progresa,"Moderniza el sistema de movilidad con corredores estratégicos, integración del transporte público (ej. Metrolínea) y promoción de modos sostenibles (bicicletas, peatonalización). Reduce tiempos de desplazamiento y contaminación mediante planes de movilidad inteligente.",4
"Vivienda, Ciudad y Territorio. Línea Estratégica 2: Territorio que Progresa","Garantiza acceso a vivienda digna con proyectos de urbanismo social y legalización de asentamientos. Implementa estrategias de densificación equilibrada, espacio público accesible y renovación urbana en zonas marginadas.",4
Minas y Energía. Línea Estratégica 2: Territorio que Progresa,"Fomenta energías limpias (solar, biomasa) y minería responsable. Incluye programas de eficiencia energética para empresas y hogares, así como transición hacia una matriz energética sostenible.",4
Gobierno Territorial. Línea Estratégica 3: Territorio Sostenible,"Implementa políticas públicas ambientales y de gestión del riesgo, fortaleciendo la gobernanza institucional para la sostenibilidad. Incluye planes de ordenamiento territorial con enfoque ecológico y mecanismos de participación ciudadana en la toma de decisiones ambientales.",4
Ambiente y Desarrollo Sostenible. Línea Estratégica 3: Territorio Sostenible,"Protege los recursos naturales mediante estrategias de conservación de cuencas hídricas, reforestación y economía circular. Implementa programas de calidad del aire, manejo integral de residuos (meta: 30% de reciclaje para 2027) y corredores verdes urbanos para aumentar espacios públicos sostenibles.",4
Gestión del Riesgo. Línea Estratégica 3: Territorio Sostenible,"Reduce vulnerabilidades ante desastres naturales con sistemas de alerta temprana, obras de mitigación en zonas de alto riesgo y capacitación comunitaria. Prioriza soluciones basadas en la naturaleza para enfrentar el cambio climático.",4
Bienestar Animal. Línea Estratégica 3: Territorio Sostenible,"Promueve la protección y tenencia responsable de animales mediante campañas de esterilización, centros de atención veterinaria gratuita y educación ciudadana. Combate el maltrato animal y fomenta la adopción de fauna doméstica en situación de calle.",4
Energías Limpias. Línea Estratégica 3: Territorio Sostenible,"Impulsa la transición energética con proyectos de energía solar en edificios públicos, transporte eléctrico y eficiencia energética en industrias. Meta: 10% de energías renovables en la matriz municipal para 2027.",4
Gobierno Territorial. Línea Estratégica 4: Territorio que Genera Valor,"Moderniza la administración pública mediante sistemas digitales, simplificación de trámites y profesionalización del talento humano. Implementa estrategias de gobierno abierto para garantizar transparencia y eficiencia en la gestión de recursos públicos.",4
Información Estadística. Línea Estratégica 4: Territorio que Genera Valor,"Fortalece los sistemas de datos territoriales para la toma de decisiones basada en evidencia. Integra plataformas tecnológicas que permitan el monitoreo en tiempo real de indicadores sociales, económicos y ambientales.",4
Organismos de Control. Línea Estratégica 4: Territorio que Genera Valor,"Promueve la rendición de cuentas y lucha contra la corrupción mediante auditorías ciudadanas, veedurías comunitarias y sistemas de denuncia protegida. Fortalece la coordinación entre Personería, Contraloría y entes de vigilancia.",4
Gobierno territorial. Línea estratégica 5: Territorio seguro,"A través de la estrategia de Gestores de Convivencia, se implementa un abordaje integral orientado a la prevención y reducción del delito, con énfasis en el hurto, la violencia interpersonal y la violencia intrafamiliar, mediante acciones pedagógicas que buscan disminuir comportamientos contrarios a la convivencia. Esta estrategia se focaliza en tres ejes principales: el respeto y garantía del derecho a la protesta pacífica, el diagnóstico y abordaje de conflictividades sociales, y el apoyo a los frentes de seguridad. Como objetivo general, el programa busca gestionar escenarios, espacios o mecanismos que articulen la participación de la comunidad, los organismos de seguridad —en especial la Policía Metropolitana de Bucaramanga— y la administración municipal. Todo esto bajo un enfoque multidisciplinario y participativo, que permita realizar diagnósticos territoriales y situacionales, sistematizar experiencias y proponer soluciones a los principales factores que generan comportamientos contrarios a la convivencia o facilitan la comisión de delitos, tanto en barrios y veredas como en el espacio público y en puntos críticos de criminalidad previamente priorizados.",4
Justicia y del derecho. Línea estratégica 5: Territorio seguro,"La ciudad de Bucaramanga enfrenta actualmente el reto de seguridad más significativo de su historia, evidenciado en la creciente vulneración de los derechos y libertades de sus habitantes. En los últimos cuatro años, las cifras estadísticas muestran un aumento sostenido en distintos tipos penales, cuyas conductas delictivas han permeado escenarios públicos, entornos escolares y espacios recreativos. Este fenómeno responde a múltiples factores causales, facilitadores y de riesgo que han contribuido al deterioro de la seguridad y a una creciente percepción de inseguridad entre la ciudadanía. Aunque las instituciones han incrementado su capacidad operativa en respuesta a esta situación, dicho esfuerzo no ha sido suficiente para contrarrestar el contexto actual ni para alcanzar la estabilización de un territorio verdaderamente seguro, próspero y sostenible.",4