date,title,thematic_area_id,project_status_id,evaluation_criteria
2025-04-22 14:03:17,Trazabilidad de productos agrícolas mediante blockchain,2,1,
2025-02-13 9:27:45,Sistema inteligente para detección de emociones en llamadas de servicio al cliente,6,2,
2025-06-30 18:41:02,Desarrollo de una aplicación móvil para monitoreo de cultivos en zonas rurales,11,3,
2025-01-05 22:15:33,Algoritmo predictivo para mantenimiento preventivo en maquinaria industrial,16,4,
2025-03-18 7:56:10,Optimización de rutas de entrega utilizando redes neuronales,21,5,
2025-05-11 12:29:44,Implementación de gemelos digitales en procesos logísticos,16,1,
2025-07-09 20:45:01,Análisis forense de ciberataques con herramientas de código abierto,31,2,
2025-02-27 3:14:38,Modelo de predicción de abandono escolar basado en machine learning,36,3,
2025-06-05 16:22:59,Plataforma web para la gestión de residuos sólidos urbanos,46,4,
2025-03-01 10:08:23,Sistema de recomendación de cursos personalizados con inteligencia artificial,51,5,